{
  "version": "1.0",
  "id": "INC-FIRE-QUICK-1",
  "type": "Fire",
  "sub_type": "Kitchen Fire",
  "location": {
    "address_line": "12 Oak Street",
    "city": "Burnaby",
    "cross_streets": "Oak & Pine",
    "landmarks": "Townhouse"
  },
  "time_of_day": "Afternoon",
  "weather": "Clear",
  "environment": "Residential",
  "caller_view": {
    "vantage_default": "Driveway",
    "what_is_obvious": ["Smoke"],
    "what_is_uncertain": ["Occupants"],
    "initial_opening_line": "Kitchen fire now"
  },
  "sensitive_topics": [],
  "progression_by_turn": [],
  "first_responder_delay": 1
}
